[
 {
  "element_id": "RMF:GOVERN",
  "framework": "AI RMF 1.0",
  "level": "function",
  "parent_id": null,
  "code": "GOVERN",
  "label": "Govern",
  "text": "A culture of risk management is cultivated and present",
  "locator": "NIST AI 100-1, Figure 5",
  "mappable": false,
  "source_type": "guidance",
  "obligation_holder": "none (voluntary)"
 },
 {
  "element_id": "RMF:MAP",
  "framework": "AI RMF 1.0",
  "level": "function",
  "parent_id": null,
  "code": "MAP",
  "label": "Map",
  "text": "Context is recognized and risks related to context are identified",
  "locator": "NIST AI 100-1, Figure 5",
  "mappable": false,
  "source_type": "guidance",
  "obligation_holder": "none (voluntary)"
 },
 {
  "element_id": "RMF:MEASURE",
  "framework": "AI RMF 1.0",
  "level": "function",
  "parent_id": null,
  "code": "MEASURE",
  "label": "Measure",
  "text": "Identified risks are assessed, analyzed, or tracked",
  "locator": "NIST AI 100-1, Figure 5",
  "mappable": false,
  "source_type": "guidance",
  "obligation_holder": "none (voluntary)"
 },
 {
  "element_id": "RMF:MANAGE",
  "framework": "AI RMF 1.0",
  "level": "function",
  "parent_id": null,
  "code": "MANAGE",
  "label": "Manage",
  "text": "Risks are prioritized and acted upon based on a projected impact",
  "locator": "NIST AI 100-1, Figure 5",
  "mappable": false,
  "source_type": "guidance",
  "obligation_holder": "none (voluntary)"
 },
 {
  "element_id": "RMF:GOVERN-1",
  "framework": "AI RMF 1.0",
  "level": "category",
  "parent_id": "RMF:GOVERN",
  "code": "GOVERN 1",
  "label": "GOVERN 1",
  "text": "Policies, processes, procedures, and practices across the organization related to the mapping, measuring, and managing of AI risks are in place, transparent, and implemented effectively.",
  "locator": "NIST AI 100-1, p. 22",
  "mappable": false,
  "source_type": "guidance",
  "obligation_holder": "none (voluntary)"
 },
 {
  "element_id": "RMF:GOVERN-2",
  "framework": "AI RMF 1.0",
  "level": "category",
  "parent_id": "RMF:GOVERN",
  "code": "GOVERN 2",
  "label": "GOVERN 2",
  "text": "Accountability structures are in place so that the appropriate teams and individuals are empowered, responsible, and trained for mapping, measuring, and managing AI risks.",
  "locator": "NIST AI 100-1, p. 23",
  "mappable": false,
  "source_type": "guidance",
  "obligation_holder": "none (voluntary)"
 },
 {
  "element_id": "RMF:GOVERN-3",
  "framework": "AI RMF 1.0",
  "level": "category",
  "parent_id": "RMF:GOVERN",
  "code": "GOVERN 3",
  "label": "GOVERN 3",
  "text": "Workforce diversity, equity, inclusion, and accessibility processes are prioritized in the mapping, measuring, and managing of AI risks throughout the lifecycle.",
  "locator": "NIST AI 100-1, p. 23",
  "mappable": false,
  "source_type": "guidance",
  "obligation_holder": "none (voluntary)"
 },
 {
  "element_id": "RMF:GOVERN-4",
  "framework": "AI RMF 1.0",
  "level": "category",
  "parent_id": "RMF:GOVERN",
  "code": "GOVERN 4",
  "label": "GOVERN 4",
  "text": "Organizational teams are committed to a culture that considers and communicates AI risk.",
  "locator": "NIST AI 100-1, p. 23",
  "mappable": false,
  "source_type": "guidance",
  "obligation_holder": "none (voluntary)"
 },
 {
  "element_id": "RMF:GOVERN-5",
  "framework": "AI RMF 1.0",
  "level": "category",
  "parent_id": "RMF:GOVERN",
  "code": "GOVERN 5",
  "label": "GOVERN 5",
  "text": "Processes are in place for robust engagement with relevant AI actors.",
  "locator": "NIST AI 100-1, p. 24",
  "mappable": false,
  "source_type": "guidance",
  "obligation_holder": "none (voluntary)"
 },
 {
  "element_id": "RMF:GOVERN-6",
  "framework": "AI RMF 1.0",
  "level": "category",
  "parent_id": "RMF:GOVERN",
  "code": "GOVERN 6",
  "label": "GOVERN 6",
  "text": "Policies and procedures are in place to address AI risks and benefits arising from third-party software and data and other supply chain issues.",
  "locator": "NIST AI 100-1, p. 24",
  "mappable": false,
  "source_type": "guidance",
  "obligation_holder": "none (voluntary)"
 },
 {
  "element_id": "RMF:MAP-1",
  "framework": "AI RMF 1.0",
  "level": "category",
  "parent_id": "RMF:MAP",
  "code": "MAP 1",
  "label": "MAP 1",
  "text": "Context is established and understood.",
  "locator": "NIST AI 100-1, p. 26",
  "mappable": false,
  "source_type": "guidance",
  "obligation_holder": "none (voluntary)"
 },
 {
  "element_id": "RMF:MAP-2",
  "framework": "AI RMF 1.0",
  "level": "category",
  "parent_id": "RMF:MAP",
  "code": "MAP 2",
  "label": "MAP 2",
  "text": "Categorization of the AI system is performed.",
  "locator": "NIST AI 100-1, p. 26",
  "mappable": false,
  "source_type": "guidance",
  "obligation_holder": "none (voluntary)"
 },
 {
  "element_id": "RMF:MAP-3",
  "framework": "AI RMF 1.0",
  "level": "category",
  "parent_id": "RMF:MAP",
  "code": "MAP 3",
  "label": "MAP 3",
  "text": "AI capabilities, targeted usage, goals, and expected benefits and costs compared with appropriate benchmarks are understood.",
  "locator": "NIST AI 100-1, p. 27",
  "mappable": false,
  "source_type": "guidance",
  "obligation_holder": "none (voluntary)"
 },
 {
  "element_id": "RMF:MAP-4",
  "framework": "AI RMF 1.0",
  "level": "category",
  "parent_id": "RMF:MAP",
  "code": "MAP 4",
  "label": "MAP 4",
  "text": "Risks and benefits are mapped for all components of the AI system including third-party software and data.",
  "locator": "NIST AI 100-1, p. 27",
  "mappable": false,
  "source_type": "guidance",
  "obligation_holder": "none (voluntary)"
 },
 {
  "element_id": "RMF:MAP-5",
  "framework": "AI RMF 1.0",
  "level": "category",
  "parent_id": "RMF:MAP",
  "code": "MAP 5",
  "label": "MAP 5",
  "text": "Impacts to individuals, groups, communities, organizations, and society are characterized.",
  "locator": "NIST AI 100-1, p. 27",
  "mappable": false,
  "source_type": "guidance",
  "obligation_holder": "none (voluntary)"
 },
 {
  "element_id": "RMF:MEASURE-1",
  "framework": "AI RMF 1.0",
  "level": "category",
  "parent_id": "RMF:MEASURE",
  "code": "MEASURE 1",
  "label": "MEASURE 1",
  "text": "Appropriate methods and metrics are identified and applied.",
  "locator": "NIST AI 100-1, p. 29",
  "mappable": false,
  "source_type": "guidance",
  "obligation_holder": "none (voluntary)"
 },
 {
  "element_id": "RMF:MEASURE-2",
  "framework": "AI RMF 1.0",
  "level": "category",
  "parent_id": "RMF:MEASURE",
  "code": "MEASURE 2",
  "label": "MEASURE 2",
  "text": "AI systems are evaluated for trustworthy characteristics.",
  "locator": "NIST AI 100-1, p. 29",
  "mappable": false,
  "source_type": "guidance",
  "obligation_holder": "none (voluntary)"
 },
 {
  "element_id": "RMF:MEASURE-3",
  "framework": "AI RMF 1.0",
  "level": "category",
  "parent_id": "RMF:MEASURE",
  "code": "MEASURE 3",
  "label": "MEASURE 3",
  "text": "Mechanisms for tracking identified AI risks over time are in place.",
  "locator": "NIST AI 100-1, p. 30",
  "mappable": false,
  "source_type": "guidance",
  "obligation_holder": "none (voluntary)"
 },
 {
  "element_id": "RMF:MEASURE-4",
  "framework": "AI RMF 1.0",
  "level": "category",
  "parent_id": "RMF:MEASURE",
  "code": "MEASURE 4",
  "label": "MEASURE 4",
  "text": "Feedback about efficacy of measurement is gathered and assessed.",
  "locator": "NIST AI 100-1, p. 31",
  "mappable": false,
  "source_type": "guidance",
  "obligation_holder": "none (voluntary)"
 },
 {
  "element_id": "RMF:MANAGE-1",
  "framework": "AI RMF 1.0",
  "level": "category",
  "parent_id": "RMF:MANAGE",
  "code": "MANAGE 1",
  "label": "MANAGE 1",
  "text": "AI risks based on assessments and other analytical output from the MAP and MEASURE functions are prioritized, responded to, and managed.",
  "locator": "NIST AI 100-1, p. 32",
  "mappable": false,
  "source_type": "guidance",
  "obligation_holder": "none (voluntary)"
 },
 {
  "element_id": "RMF:MANAGE-2",
  "framework": "AI RMF 1.0",
  "level": "category",
  "parent_id": "RMF:MANAGE",
  "code": "MANAGE 2",
  "label": "MANAGE 2",
  "text": "Strategies to maximize AI benefits and minimize negative impacts are planned, prepared, implemented, documented, and informed by input from relevant AI actors.",
  "locator": "NIST AI 100-1, p. 32",
  "mappable": false,
  "source_type": "guidance",
  "obligation_holder": "none (voluntary)"
 },
 {
  "element_id": "RMF:MANAGE-3",
  "framework": "AI RMF 1.0",
  "level": "category",
  "parent_id": "RMF:MANAGE",
  "code": "MANAGE 3",
  "label": "MANAGE 3",
  "text": "AI risks and benefits from third-party entities are managed.",
  "locator": "NIST AI 100-1, p. 32",
  "mappable": false,
  "source_type": "guidance",
  "obligation_holder": "none (voluntary)"
 },
 {
  "element_id": "RMF:MANAGE-4",
  "framework": "AI RMF 1.0",
  "level": "category",
  "parent_id": "RMF:MANAGE",
  "code": "MANAGE 4",
  "label": "MANAGE 4",
  "text": "Risk treatments, including response and recovery, and communication plans for the identified and measured AI risks are documented and monitored regularly.",
  "locator": "NIST AI 100-1, p. 33",
  "mappable": false,
  "source_type": "guidance",
  "obligation_holder": "none (voluntary)"
 },
 {
  "element_id": "RMF:GOVERN-1.1",
  "framework": "AI RMF 1.0",
  "level": "subcategory",
  "parent_id": "RMF:GOVERN-1",
  "code": "GOVERN 1.1",
  "label": "GOVERN 1.1",
  "text": "Legal and regulatory requirements involving AI are understood, managed, and documented.",
  "locator": "NIST AI 100-1, p. 22",
  "mappable": true,
  "source_type": "guidance",
  "obligation_holder": "none (voluntary)"
 },
 {
  "element_id": "RMF:GOVERN-1.2",
  "framework": "AI RMF 1.0",
  "level": "subcategory",
  "parent_id": "RMF:GOVERN-1",
  "code": "GOVERN 1.2",
  "label": "GOVERN 1.2",
  "text": "The characteristics of trustworthy AI are integrated into organizational policies, processes, procedures, and practices.",
  "locator": "NIST AI 100-1, p. 22",
  "mappable": true,
  "source_type": "guidance",